{
  "$schema": "../../../../schemas/nfc-hunt-page.schema.json",
  "tagRef": {
    "tagID": "TAGXXX",
    "room": "Foyer",
    "object": "StartBlock"
  },
  "node": 0,
  "game": {
    "gameName": "FamilyHunt2026",
    "gameVersion": "260113.01"
  },
  "defaults": {
    "locale": "en-US",
    "timeLimitSeconds": 900,
    "cooldownSeconds": 180,
    "maxHints": 3
  },
  "gating": {
    "requires": [],
    "strictOrder": true,
    "unlockOnScan": true
  },
  "pages": [
    {
      "level": 1,
      "characteristics": { "label": "kiddos", "minAge": 5, "maxAge": 8 },
      "contents": {
        "pageID": "PXXX-1",
        "UIInfo": {
          "title": "The Hunt Begins",
          "subtitle": "Welcome, brave wanderer, let’s start this Quest!",
          "picture": true
        },
        "lessonPuzzle": {
          "backgroundText": "At the end of a quiet, tree-lined road stands a blue, two-story house with white shutters and a wraparound porch.",
          "question": "What color is the house?",
          "answers": [
            { "id": 1, "text": "White", "isCorrect": false },
            { "id": 2, "text": "Red", "isCorrect": false },
            { "id": 3, "text": "Blue", "isCorrect": true },
            { "id": 4, "text": "Green", "isCorrect": false }
          ],
          "successResponse": "Great job! ⭐ Let’s keep going!",
          "failureResponse": "Oops! Try again—you’re almost there!"
        },
        "clueToNextTag": {
          "text": "I’m tall, cold, and hum quietly while guarding snacks and drinks. Find me where meals are made.",
          "hint1": "I keep food cold and fresh.",
          "hint2": "I’m in the kitchen.",
          "hint3": "Find the refrigerator."
        }
      }
    },
    {
      "level": 2,
      "characteristics": { "label": "tweens", "minAge": 9, "maxAge": 12 },
      "contents": {
        "pageID": "PXXX-2",
        "UIInfo": {
          "title": "The Hunt Begins",
          "subtitle": "Your journey is officially underway.",
          "picture": true
        },
        "lessonPuzzle": {
          "backgroundText": "A blue house with white shutters sits quietly at the end of the road, warm light glowing from its windows.",
          "question": "Which color best describes the house?",
          "answers": [
            { "id": 1, "text": "Red", "isCorrect": false },
            { "id": 2, "text": "Blue", "isCorrect": true },
            { "id": 3, "text": "Gray", "isCorrect": false },
            { "id": 4, "text": "Yellow", "isCorrect": false }
          ],
          "successResponse": "Correct! Nice attention to detail.",
          "failureResponse": "Not quite—re-read the description and try again."
        },
        "clueToNextTag": {
          "text": "Next stop is the kitchen. Look for the tall appliance that keeps leftovers cold.",
          "hint1": "You open it multiple times a day.",
          "hint2": "Milk lives here.",
          "hint3": "The refrigerator."
        }
      }
    },
    {
      "level": 3,
      "characteristics": { "label": "youths", "minAge": 13, "maxAge": 17 },
      "contents": {
        "pageID": "PXXX-3",
        "UIInfo": {
          "title": "Observation Matters",
          "subtitle": "Details unlock progress.",
          "picture": true
        },
        "lessonPuzzle": {
          "backgroundText": "The house described is blue with white shutters and a stone chimney.",
          "question": "Which detail confirms the house color?",
          "answers": [
            { "id": 1, "text": "White shutters", "isCorrect": false },
            { "id": 2, "text": "Blue exterior walls", "isCorrect": true },
            { "id": 3, "text": "Stone chimney", "isCorrect": false },
            { "id": 4, "text": "Warm lighting", "isCorrect": false }
          ],
          "successResponse": "Correct. Details matter.",
          "failureResponse": "Incorrect. Focus on the main descriptor."
        },
        "clueToNextTag": {
          "text": "Proceed to the kitchen and locate the refrigerator.",
          "hint1": "Cold storage.",
          "hint2": "Tall appliance.",
          "hint3": "Refrigerator."
        }
      }
    },
    {
      "level": 4,
      "characteristics": { "label": "adults", "minAge": 18, "maxAge": 99 },
      "contents": {
        "pageID": "PXXX-4",
        "UIInfo": {
          "title": "Initiation Complete",
          "subtitle": "Let’s move.",
          "picture": true
        },
        "lessonPuzzle": {
          "backgroundText": "A blue two-story house anchors the scene described.",
          "question": "Primary exterior color?",
          "answers": [
            { "id": 1, "text": "Blue", "isCorrect": true },
            { "id": 2, "text": "White", "isCorrect": false },
            { "id": 3, "text": "Gray", "isCorrect": false },
            { "id": 4, "text": "Green", "isCorrect": false }
          ],
          "successResponse": "Confirmed. Continue.",
          "failureResponse": "Incorrect. Re-evaluate."
        },
        "clueToNextTag": {
          "text": "Kitchen. Refrigerator.",
          "hint1": "Cold appliance.",
          "hint2": "Food storage.",
          "hint3": "Refrigerator."
        }
      }
    }
  ]
}
